id_paper,id_publisher
"BURCH E, 2002, MEDIA CULT SOC, V24, P571, DOI 10.1177/016344370202400408",SAGE PUBLICATIONS LTD
"ROBINSON A, 2002, ONLINE, V26, P29",ONLINE INC
"CHRIST WG, 2002, J BROADCAST ELECTRON, V46, P321, DOI 10.1207/S15506878JOBEM4602_9",BROADCAST EDUC ASSOC
"EDGERTON GR, 2002, J POP FILM TV, V30, P2, DOI 10.1080/01956050209605553",HELDREF PUBLICATIONS
"ROCKLER NR, 2002, J POP FILM TV, V30, P16, DOI 10.1080/01956050209605555",ROUTLEDGE JOURNALS
"ROCKLER NR, 2002, J POP FILM TV, V30, P16, DOI 10.1080/01956050209605555", TAYLOR & FRANCIS LTD
