id_paper,id_publisher
"WIAZOWSKI J, 2014, ASSIST TECHNOL, V26, P227, DOI 10.1080/10400435.2014.928389",R E S N A PRESS
"VIDAUSKYTE L, 2014, LOGOS-VILNIUS, P77",LOGOS
"SUR E, 2014, COMUNICAR, P119, DOI 10.3916/C42-2014-11",GRUPO COMUNICAR
"LEE AYL, 2014, COMUNICAR, P137, DOI 10.3916/C42-2014-13",GRUPO COMUNICAR
"ABAD ALCALA L, 2014, COMUNICAR, P173, DOI 10.3916/C42-2014-17",GRUPO COMUNICAR
"JANNETH SANTOS MARTINEZ C, 2013, HIST COMUN SOC, V18, P781, DOI 10.5209/REV_HICS.2013.V18.44365",UNIV COMPLUTENSE MADRID
"JANNETH SANTOS MARTINEZ C, 2013, HIST COMUN SOC, V18, P781, DOI 10.5209/REV_HICS.2013.V18.44365", SERVICIO PUBLICACIONES
"CAKMAK E, 2013, ANTHROPOLOGIST, V16, P531",KAMLA-RAJ ENTERPRISES
"MIHAILIDIS P, 2013, AM BEHAV SCI, V57, P1611, DOI 10.1177/0002764213489015",SAGE PUBLICATIONS INC
"NEYS J, 2013, NEW MEDIA SOC, V15, P1199, DOI 10.1177/1461444813496212B",SAGE PUBLICATIONS LTD
"KAESTLE C, 2013, DRUG ALCOHOL REV, V32, P44",WILEY-BLACKWELL
"WALLIS R, 2013, EUR J COMMUN, V28, P527, DOI 10.1177/0267323113483605",SAGE PUBLICATIONS LTD
"LIN TB, 2013, EDUC TECHNOL SOC, V16, P160",IEEE COMPUTER SOC
"LIN TB, 2013, EDUC TECHNOL SOC, V16, P160", LEARNING  TECHNOLOGY TASK FORCE
"VRABEC N, 2013, EUR J SCI THEOL, V9, P211",ACAD ORGANISATION ENVIRONMENTAL ENGINEERING & SUSTAINABLE DEV
"CLARK LS, 2013, JOURNALISM, V14, P885, DOI 10.1177/1464884913478361",SAGE PUBLICATIONS INC
"ANTON CUADRADO R, 2013, HIST COMUN SOC, V18, P231, DOI 10.5209/REV_HICS.2013.V18.43963",UNIV COMPLUTENSE MADRID
"ANTON CUADRADO R, 2013, HIST COMUN SOC, V18, P231, DOI 10.5209/REV_HICS.2013.V18.43963", SERVICIO PUBLICACIONES
"GOLOS DB, 2013, AM ANN DEAF, V158, P411, DOI 10.1353/AAD.2013.0039",GALLAUDET UNIV PRESS
"TUZEL S, 2013, KURAM UYGUL EGIT BIL, V13, P2310",EDAM
"RUTTEN K, 2013, CLCWEB-COMP LIT CULT, V15, DOI 10.7771/1481-4374.2238",PURDUE UNIV PRESS
"CASEY G, 2013, J ADOLESC ADULT LIT, V57, P60, DOI 10.1002/JAAL.216",WILEY-BLACKWELL
"KAESTLE CE, 2013, AM J HEALTH PROMOT, V27, P366, DOI 10.4278/AJHP.120221-ARB-105",AMER JOURNAL HEALTH PROMOTION INC
"BAZALGETTE C, 2013, LITERACY, V47, P95, DOI 10.1111/J.1741-4369.2012.00666.X",WILEY-BLACKWELL
"MCLEAN SA, 2013, BODY IMAGE, V10, P282, DOI 10.1016/J.BODYIM.2013.01.009",ELSEVIER SCIENCE BV
"ERSTAD O, 2013, JAVNOST-PUBLIC, V20, P83, DOI 10.1080/13183222.2013.11009115",EUROPEAN INST COMMUNICATION CULTURE
"CHEN YC, 2013, J HEALTH COMMUN, V18, P723, DOI 10.1080/10810730.2012.757387",TAYLOR & FRANCIS INC
"LIM SS, 2013, LEARN MEDIA TECHNOL, V38, P145, DOI 10.1080/17439884.2013.756515",ROUTLEDGE JOURNALS
"LIM SS, 2013, LEARN MEDIA TECHNOL, V38, P145, DOI 10.1080/17439884.2013.756515", TAYLOR & FRANCIS LTD
"HOBBS R, 2013, LEARN MEDIA TECHNOL, V38, P182, DOI 10.1080/17439884.2013.756517",ROUTLEDGE JOURNALS
"HOBBS R, 2013, LEARN MEDIA TECHNOL, V38, P182, DOI 10.1080/17439884.2013.756517", TAYLOR & FRANCIS LTD
"PARKER JK, 2013, J ADOLESC ADULT LIT, V56, P668, DOI 10.1002/JAAL.194",WILEY-BLACKWELL
"YOUNG C, 2013, READ TEACH, V66, P670, DOI 10.1002/TRTR.1175",WILEY-BLACKWELL
"ALVAREZ C, 2013, COMPUT EDUC, V63, P368, DOI 10.1016/J.COMPEDU.2012.12.019",PERGAMON-ELSEVIER SCIENCE LTD
"DEL-MORAL-PEREZ ME, 2013, COMUNICAR, P173, DOI 10.3916/C40-2013-03-08",GRUPO COMUNICAR
"MERCHANT G, 2013, LANG EDUC-UK, V27, P144, DOI 10.1080/09500782.2012.760586",ROUTLEDGE JOURNALS
"MERCHANT G, 2013, LANG EDUC-UK, V27, P144, DOI 10.1080/09500782.2012.760586", TAYLOR & FRANCIS LTD
"MACNAMARA J, 2013, CONTINUUM-J MEDIA CU, V27, P160, DOI 10.1080/10304312.2013.736950",ROUTLEDGE JOURNALS
"MACNAMARA J, 2013, CONTINUUM-J MEDIA CU, V27, P160, DOI 10.1080/10304312.2013.736950", TAYLOR & FRANCIS LTD
"THORNE-WALLINGTON E, 2013, INFORM TECHNOL LIBR, V32, P53, DOI 10.6017/ITAL.V32I4.2309",AMER LIBRARY ASSOC
"ROBERTS-SMITH J, 2013, CAN THEATRE REV, V156, P40, DOI 10.3138/CTR.156.008",UNIV TORONTO PRESS INC
"KOPPE H, 2013, PRAX KINDERPSYCHOL K, V62, P534",VANDENHOECK & RUPRECHT
"LEE J, 2013, RECALL, V25, P159, DOI 10.1017/S0958344012000298",CAMBRIDGE UNIV PRESS
"CORDERO E, 2012, B AM METEOROL SOC, V93, P1813, DOI 10.1175/BAMS-93-12-1813",AMER METEOROLOGICAL SOC
"LAM WSE, 2012, PHI DELTA KAPPAN, V94, P62, DOI 10.1177/003172171209400416",PHI DELTA KAPPA
"MORRELL E, 2012, READ TEACH, V66, P300, DOI 10.1002/TRTR.01125",WILEY-BLACKWELL
"WILSON C, 2012, COMUNICAR, P15, DOI 10.3916/C39-2012-02-01",GRUPO COMUNICAR
"SALEH I, 2012, COMUNICAR, P35, DOI 10.3916/C39-2012-02-03",GRUPO COMUNICAR
"MOELLER S, 2012, COMUNICAR, P45, DOI 10.3916/C39-2012-02-04",GRUPO COMUNICAR
"CULVER SH, 2012, COMUNICAR, P73, DOI 10.3916/C39-2012-02-07",GRUPO COMUNICAR
"REIA-BAPTISTA V, 2012, COMUNICAR, P81, DOI 10.3916/C39-2012-02-08",GRUPO COMUNICAR
"PEREIRA S, 2012, COMUNICAR, P91, DOI 10.3916/C39-2012-02-09",GRUPO COMUNICAR
"MORA J, 2012, COMUNICAR, P139, DOI 10.3916/C39-2012-03-04",GRUPO COMUNICAR
"VRAGA EK, 2012, JOURNALISM, V13, P942, DOI 10.1177/1464884912455906",SAGE PUBLICATIONS INC
"SZABO K, 2012, INT J BEHAV MED, V19, PS151",SPRINGER
"BRICKMAN P, 2012, AM BIOL TEACH, V74, P374, DOI 10.1525/ABT.2012.74.6.4",NATL ASSOC BIOLOGY TEACHERS INC
"RUNDGREN CJ, 2012, PUBLIC UNDERST SCI, V21, P759, DOI 10.1177/0963662510377562",SAGE PUBLICATIONS LTD
"JEONG SH, 2012, J COMMUN, V62, DOI 10.1111/J.1460-2466.2012.01643.X",WILEY
"SALGADO MV, 2012, NICOTINE TOB RES, V14, P516, DOI 10.1093/NTR/NTR240",OXFORD UNIV PRESS
"KESTEN A, 2012, ENER EDUC SCI TECH-B, V4, P1131",SILA SCIENCE
"GREENE K, 2012, ANN BEHAV MED, V43, PS57",SPRINGER
"MARTIN AG, 2012, COMUNICAR, P10, DOI 10.3916/C38-2012-02-00",GRUPO COMUNICAR
"SOEP E, 2012, COMUNICAR, P93, DOI 10.3916/C38-2012-02-10",GRUPO COMUNICAR
"DEL VALLE C, 2012, COMUNICAR, P183, DOI 10.3916/C38-2012-03-10",GRUPO COMUNICAR
"GOMEZ JIA, 2012, COMUNICAR, P7, DOI 10.3916/C38-2012-01-01",GRUPO COMUNICAR
"KENDALL A, 2012, COMUNICAR, P21, DOI 10.3916/C38-2012-02-02",GRUPO COMUNICAR
"MARTIN AG, 2012, COMUNICAR-a, P31, DOI 10.3916/C38-2012-02-03",GRUPO COMUNICAR
"PENUEL WR, 2012, EARLY CHILD RES Q, V27, P115, DOI 10.1016/J.ECRESQ.2011.07.002",ELSEVIER SCIENCE INC
"PARK S, 2012, MEDIA INT AUST, P87, DOI 10.1177/1329878X1214200111",UNIV QUEENSLAND PRESS
"AUSTIN EW, 2012, J AM COLL HEALTH, V60, P548, DOI 10.1080/07448481.2012.726302",ROUTLEDGE JOURNALS
"AUSTIN EW, 2012, J AM COLL HEALTH, V60, P548, DOI 10.1080/07448481.2012.726302", TAYLOR & FRANCIS LTD
"BONNSTETTER BE, 2012, J POP FILM TV, V40, P94, DOI 10.1080/01956051.2011.636395",ROUTLEDGE JOURNALS
"BONNSTETTER BE, 2012, J POP FILM TV, V40, P94, DOI 10.1080/01956051.2011.636395", TAYLOR & FRANCIS LTD
"PINKLETON BE, 2012, J HEALTH COMMUN, V17, P460, DOI 10.1080/10810730.2011.635770",TAYLOR & FRANCIS INC
"MUNK C, 2012, Z ENTWICKL PADAGOGIS, V44, P81, DOI 10.1026/0049-8637/A000063",HOGREFE & HUBER PUBLISHERS
"WATERHOUSE M, 2012, DISCOURSE-ABINGDON, V33, P129, DOI 10.1080/01596306.2012.632173",ROUTLEDGE JOURNALS
"WATERHOUSE M, 2012, DISCOURSE-ABINGDON, V33, P129, DOI 10.1080/01596306.2012.632173", TAYLOR & FRANCIS LTD
"GEIMER A, 2012, Z SOZIOL ERZIEH SOZI, V32, P4",JUVENTA VERLAG GMBH
"KAHNE J, 2012, INT J COMMUN-US, V6, P1",USC ANNENBERG PRESS
"PAGE RM, 2011, HEALTH EDUC J, V70, P446, DOI 10.1177/0017896910379692",SAGE PUBLICATIONS LTD
"JURKOWSKI ET, 2011, GERONTOLOGIST, V51, P79",OXFORD UNIV PRESS INC
"CHANG CS, 2011, ASIA-PAC EDUC RES, V20, P604",DE LA SALLE UNIV-MANILA
"STEWART B, 2011, BRIT J EDUC TECHNOL, V42, PE167, DOI 10.1111/J.1467-8535.2011.01247.X",WILEY-BLACKWELL
"DOMINE V, 2011, LIBR TRENDS, V60, P440, DOI 10.1353/LIB.2011.0038",JOHNS HOPKINS UNIV PRESS
"HUIJSER H, 2011, MEDIA INT AUST, P181",UNIV QUEENSLAND PRESS
"WINDLE J, 2011, AUST EDUC RES, V38, P311, DOI 10.1007/S13384-011-0030-Z",SPRINGER
"BURNETT C, 2011, ENGL TEACH-PRACT CRI, V10, P41",UNIV WAIKATO
"FISHER H, 2011, AUST LIBR J, V60, P176, DOI 10.1080/00049670.2011.10722599",AUSTRALIAN LIBRARY & INFORMATION ASSOC LTD
"TURNER KCN, 2011, J ADOLESC ADULT LIT, V54, P613, DOI 10.1598/JAAL.54.8.6",INT READING ASSOC
"HALLIWELL E, 2011, BRIT J HEALTH PSYCH, V16, P396, DOI 10.1348/135910710X515714",WILEY
"PEREZ-STABLE EJ, 2011, J GEN INTERN MED, V26, PS246",SPRINGER
"YAMADA-RICE D, 2011, LITERACY, V45, P32, DOI 10.1111/J.1741-4369.2011.00578.X",WILEY-BLACKWELL
"CHANG CS, 2011, TURK ONLINE J EDUC T, V10, P63",TURKISH ONLINE JOURNAL EDUCATIONAL TECH-TOJET
"LEVIN-ZAMIR D, 2011, HEALTH EDUC RES, V26, P323, DOI 10.1093/HER/CYR007",OXFORD UNIV PRESS
"DE LA PISCINA TR, 2011, COMUNICAR, P157, DOI 10.3916/C36-2011-03-07",GRUPO COMUNICAR
"KOLTAY T, 2011, MEDIA CULT SOC, V33, P211, DOI 10.1177/0163443710393382",SAGE PUBLICATIONS LTD
"COOPER CB, 2011, BIOSCIENCE, V61, P231, DOI 10.1525/BIO.2011.61.3.8",OXFORD UNIV PRESS
"HAUSER SL, 2011, ANN NEUROL, V69, PA9, DOI 10.1002/ANA.22410",WILEY
"PAEK HJ, 2011, HEALTH EDUC RES, V26, P131, DOI 10.1093/HER/CYQ082",OXFORD UNIV PRESS
"AMORY A, 2011, EDUC CHANGE, V15, PS111, DOI 10.1080/16823206.2011.643634",TAYLOR & FRANCIS LTD
"BOYD MJ, 2011, ADV CHILD DEV BEHAV, V41, P251",ELSEVIER ACADEMIC PRESS INC
"CINCOTTA-SEGI A, 2011, COMPARE, V41, P195, DOI 10.1080/03057925.2011.547285",ROUTLEDGE JOURNALS
"CINCOTTA-SEGI A, 2011, COMPARE, V41, P195, DOI 10.1080/03057925.2011.547285", TAYLOR & FRANCIS LTD
"CABERO-ALMENARA J, 2011, EDUC XX1, V14, P89",UNIV NACIONAL EDUCACION DISTANCIA
"HOBBS R, 2011, J BROADCAST ELECTRON, V55, P419, DOI 10.1080/08838151.2011.597594",ROUTLEDGE JOURNALS
"HOBBS R, 2011, J BROADCAST ELECTRON, V55, P419, DOI 10.1080/08838151.2011.597594", TAYLOR & FRANCIS LTD
"HOBBS R, 2011, J BROADCAST ELECTRON-a, V55, P601, DOI 10.1080/08838151.2011.619399",ROUTLEDGE JOURNALS
"HOBBS R, 2011, J BROADCAST ELECTRON-a, V55, P601, DOI 10.1080/08838151.2011.619399", TAYLOR & FRANCIS LTD
"PAGE RM, 2011, J SCHOOL HEALTH, V81, P34, DOI 10.1111/J.1746-1561.2010.00555.X",WILEY-BLACKWELL PUBLISHING
"PAGE RM, 2011, J SCHOOL HEALTH, V81, P34, DOI 10.1111/J.1746-1561.2010.00555.X", INC
"GUSTAVSON A, 2011, LIBR HI TECH, V29, P725, DOI 10.1108/07378831111189796",EMERALD GROUP PUBLISHING LTD
"EDYTA C, 2011, PSYCHOL HEALTH, V26, P105",TAYLOR & FRANCIS LTD
"NAM S, 2010, JAVNOST-PUBLIC, V17, P5, DOI 10.1080/13183222.2010.11009038",EUROPEAN INST COMMUNICATION CULTURE
"PIKO BF, 2010, EUR J PUBLIC HEALTH, V20, P246",OXFORD UNIV PRESS
"GUNDERS J, 2010, MEDIA INT AUST, P158",UNIV QUEENSLAND PRESS
"AGUADED-GOMEZ JI, 2010, COMUNICAR, P7, DOI 10.3916/C35-2010-01-01",GRUPO COMUNICAR
"ZAGALO N, 2010, COMUNICAR, P61, DOI 10.3916/C35-2010-02-06",GRUPO COMUNICAR
"AKAR-VURAL R, 2010, URBAN EDUC, V45, P740, DOI 10.1177/0042085910377289",CORWIN PRESS INC A SAGE PUBLICATIONS CO
"AUSTEN RA, 2010, ISLAM AFR-US, V1, P217, DOI 10.5192/215409910794105869",NORTHWESTERN UNIV PRESS
"MERSKIN D, 2010, J MASS COMMUN Q, V87, P668",ASSOC EDUC JOURNALISM MASS COMMUNICATION
"KUPERSMIDT JB, 2010, PEDIATRICS, V126, P525, DOI 10.1542/PEDS.2010-0068",AMER ACAD PEDIATRICS
"TSENG YH, 2010, COMPUT EDUC, V55, P165, DOI 10.1016/J.COMPEDU.2010.01.002",PERGAMON-ELSEVIER SCIENCE LTD
"TEURLINGS J, 2010, EUR J CULT STUD, V13, P359, DOI 10.1177/1367549410363202",SAGE PUBLICATIONS LTD
"ANDERSON DR, 2010, DEV REV, V30, P239, DOI 10.1016/J.DR.2010.03.004",ACADEMIC PRESS INC ELSEVIER SCIENCE
"VAN DE VORD R, 2010, INTERNET HIGH EDUC, V13, P170, DOI 10.1016/J.IHEDUC.2010.03.001",ELSEVIER SCIENCE INC
"ELMA C, 2010, KURAM UYGULAMA EGI, V10, P1439",EDAM
"TYNER K, 2010, ENGL TEACH-PRACT CRI, V9, P1",UNIV WAIKATO
"PARTINGTON A, 2010, ENGL TEACH-PRACT CRI, V9, P73",UNIV WAIKATO
"ANDERSEN N, 2010, ENGL TEACH-PRACT CRI, V9, P103",UNIV WAIKATO
"AGUADED-GOMEZ JI, 2010, COMUNICAR-a, P7, DOI 10.3916/C34-2010-01-01",GRUPO COMUNICAR
"GAINER JS, 2010, J ADOLESC ADULT LIT, V53, P364, DOI 10.1598/JAAL.53.5.2",INT READING ASSOC
"POTTER WJ, 2010, J BROADCAST ELECTRON, V54, P675, DOI 10.1080/08838151.2011.521462",ROUTLEDGE JOURNALS
"POTTER WJ, 2010, J BROADCAST ELECTRON, V54, P675, DOI 10.1080/08838151.2011.521462", TAYLOR & FRANCIS LTD
"TANRIVERDI B, 2010, KURAM UYGULAMA EGI, V10, P1187",EDAM
"WALKER TL, 2010, LEARN MEDIA TECHNOL, V35, P1, DOI 10.1080/17439880903574366",ROUTLEDGE JOURNALS
"WALKER TL, 2010, LEARN MEDIA TECHNOL, V35, P1, DOI 10.1080/17439880903574366", TAYLOR & FRANCIS LTD
"KEARY M, 2010, ONLINE INFORM REV, V34, P816, DOI 10.1108/14684521011084654",EMERALD GROUP PUBLISHING LIMITED
"HARRETT J, 2009, LITERACY, V43, P134, DOI 10.1111/J.1741-4369.2009.00510.X",WILEY-BLACKWELL
"FOGG V, 2009, BRIT J EDUC STUD, V57, P328, DOI 10.1111/J.1467-8527.2009.437_1.X",WILEY-BLACKWELL PUBLISHING
"FOGG V, 2009, BRIT J EDUC STUD, V57, P328, DOI 10.1111/J.1467-8527.2009.437_1.X", INC
"BADKE W, 2009, ONLINE, V33, P47",ONLINE INC
"PRIMACK BA, 2009, HEALTH EDUC RES, V24, P608, DOI 10.1093/HER/CYN062",OXFORD UNIV PRESS
"PLESTER B, 2009, J COMPUT-MEDIAT COMM, V14, P1108, DOI 10.1111/J.1083-6101.2009.01483.X",WILEY-BLACKWELL
"WILKSCH SM, 2009, J AM ACAD CHILD PSY, V48, P652, DOI 10.1097/CHI.0B013E3181A1F559",ELSEVIER SCIENCE INC
"GAINER JS, 2009, READ TEACH, V62, P674, DOI 10.1598/RT.62.8.5",INT READING ASSOC
"SKAAR H, 2009, LITERACY, V43, P36, DOI 10.1111/J.1741-4369.2009.00502.X",WILEY-BLACKWELL
"PRIMACK BA, 2009, AM J HEALTH BEHAV, V33, P192",PNG PUBLICATIONS
"GOMEZ JIA, 2009, COMUNICAR, P7, DOI 10.3916/C32-2009-00-001",GRUPO COMUNICAR
"MOELLER S, 2009, COMUNICAR, P65, DOI 10.3916/C32-2009-02-005",GRUPO COMUNICAR
"CHEUNG CK, 2009, COMUNICAR, P73, DOI 10.3916/C32-2009-02-006",GRUPO COMUNICAR
"SALEH I, 2009, COMUNICAR, P119, DOI 10.3916/C32-2009-02-010",GRUPO COMUNICAR
"SALOMON E, 2009, COMUNICAR, P147, DOI 10.3916/C32-2009-02-013",GRUPO COMUNICAR
"DAVID JL, 2009, EDUC LEADERSHIP, V66, P84",ASSOC SUPERVISION CURRICULUM DEVELOPMENT
"CONSIDINE D, 2009, J ADOLESC ADULT LIT, V52, P471, DOI 10.1598/JAAL.52.6.2",INT READING ASSOC
"ROCK M, 2009, HEALTH EDUC RES, V24, P153, DOI 10.1093/HER/CYN008",OXFORD UNIV PRESS
"ERJAVEC K, 2009, DIDACT SLOV-PEDAGOS, V24, P36",DRUSTVO PEDAGOSKIH DELAVCEV DOLENJSKE
"SNYDER I, 2009, ENGL AUST, V44, P13",AATE-AUSTRALIAN ASSOC TEACHING ENGLISH
"ELMA C, 2009, HACET UNIT EGIT FAK, P87",HACETTEPE UNIV
"SOURBATI M, 2009, INFORM SOC, V25, P248, DOI 10.1080/01972240903028680",TAYLOR & FRANCIS INC
"TYMA AW, 2009, INT J COMMUN-US, V3, P891",USC ANNENBERG PRESS
"BUCKINGHAM D, 2009, INT J CULT POLICY, V15, P217, DOI 10.1080/10286630802651602",ROUTLEDGE JOURNALS
"BUCKINGHAM D, 2009, INT J CULT POLICY, V15, P217, DOI 10.1080/10286630802651602", TAYLOR & FRANCIS LTD
"CHEN HL, 2009, J ACAD LIBR, V35, P14, DOI 10.1016/J.ACALIB.2008.10.021",ELSEVIER SCIENCE INC
"PRIMACK BA, 2009, J HEALTH COMMUN, V14, P541, DOI 10.1080/10810730903089598",TAYLOR & FRANCIS INC
"ARCHAKIS A, 2009, J LANG POLIT, V8, P359, DOI 10.1075/JLP.8.3.02ARC",JOHN BENJAMINS PUBLISHING COMPANY
"ZILLMANN D, 2009, MEDIA PSYCHOL, V12, P394, DOI 10.1080/15213260903287275",LAWRENCE ERLBAUM ASSOC INC-TAYLOR & FRANCIS
"BARONE D, 2008, READ TEACH, V62, P292, DOI 10.1598/RT.62.4.2",INT READING ASSOC
"JENSEN AP, 2008, J ADOLESC ADULT LIT, V52, P261, DOI 10.1598/JAAL.52.3.10",INT READING ASSOC
"TORNERO JMP, 2008, COMUNICAR, P15, DOI 10.3916/C31-2008-01-002",GRUPO COMUNICAR
"ABELLAN G, 2008, COMUNICAR, P129, DOI 10.3916/C31-2008-01-016",GRUPO COMUNICAR
"PINKLETON BE, 2008, HEALTH COMMUN, V23, P462, DOI 10.1080/10410230802342135",LAWRENCE ERLBAUM ASSOC INC-TAYLOR & FRANCIS
"COMER JS, 2008, J CONSULT CLIN PSYCH, V76, P568, DOI 10.1037/0022-006X.76.4.568",AMER PSYCHOLOGICAL ASSOC
"WILKSCH SM, 2008, J AM ACAD CHILD PSY, V47, P939, DOI 10.1097/CHI.0B013E3181799F4A",LIPPINCOTT WILLIAMS & WILKINS
"LUMBY C, 2008, MEDIA INT AUST, P80",UNIV QUEENSLAND PRESS
"RENNIE E, 2008, MEDIA INT AUST, P95, DOI 10.1177/1329878X0812800112",UNIV QUEENSLAND PRESS
"PARK SH, 2008, BRIT J EDUC TECHNOL, V39, P732, DOI 10.1111/J.1467-8535.2008.00824.X",BLACKWELL PUBLISHING
"BERGSMA LJ, 2008, HEALTH EDUC RES, V23, P522, DOI 10.1093/HER/CYM084",OXFORD UNIV PRESS
"WAN GF, 2008, THEOR PRACT, V47, P178, DOI 10.1080/00405840802153783",OHIO STATE UNIV
"WAN GF, 2008, THEOR PRACT, V47, P178, DOI 10.1080/00405840802153783", COLLEGE EDUCATION
"ARGYROPOULOS VS, 2008, J VISUAL IMPAIR BLIN, V102, P221",AMER FOUNDATION BLIND
"TYNER K, 2008, COMUNICAR, P79, DOI 10.3916/C30-2008-01-012",GRUPO COMUNICAR
"REIA-BAPTISTA V, 2008, COMUNICAR, P427, DOI 10.3916/C31-2008-03-030",GRUPO COMUNICAR
"GOMEZ JIA, 2008, ESTUD SOBRE MENSAJ P, V14, P293",UNIV COMPLUTENSE MADRID
"GOMEZ JIA, 2008, ESTUD SOBRE MENSAJ P, V14, P293", SERVICIO PUBLICACIONES
"ANIKO B, 2008, INF TARSAD, V8, P110",INFONIA
"TIPPETT CD, 2008, INT J SCI EDUC, V30, P1265, DOI 10.1080/09500690801908348",ROUTLEDGE JOURNALS
"TIPPETT CD, 2008, INT J SCI EDUC, V30, P1265, DOI 10.1080/09500690801908348", TAYLOR & FRANCIS LTD
"GAINES E, 2008, SEMIOTICA, V171, P239, DOI 10.1515/SEMI.2008.076",WALTER DE GRUYTER & CO
"ERICKSON K, 2008, VISUAL STUD, V23, P98",TAYLOR & FRANCIS LTD
"GRIFFIN M, 2008, VISUAL STUD, V23, P113, DOI 10.1080/14725860802276255",TAYLOR & FRANCIS LTD
"AHN S, 2007, STUD SECOND LANG ACQ, V29, P617, DOI 10.1017/S0272263107070453",CAMBRIDGE UNIV PRESS
"AUSTIN EW, 2007, COMMUN RES, V34, P483, DOI 10.1177/0093650297305233",SAGE PUBLICATIONS INC
"COOPERMAN L, 2007, REF USER SERV Q, V47, P94",AMER LIBRARY ASSOC
"EAGLE L, 2007, J ADVERTISING, V36, P101, DOI 10.2753/JOA0091-3367360207",M E SHARPE INC
"FLEMING JJ, 2007, J MASS COMMUN Q, V84, P402",ASSOC EDUC JOURNALISM MASS COMMUNICATION
"CHOMA BL, 2007, SEX ROLES, V56, P581, DOI 10.1007/S11199-007-9200-X",SPRINGER/PLENUM PUBLISHERS
"HAYES M, 2007, SOC SCI MED, V64, P1842, DOI 10.1016/J.SOCSCIMED.2007.01.015",PERGAMON-ELSEVIER SCIENCE LTD
"REIA-BAPTISTA V, 2007, COMUNICAR, P25",GRUPO COMUNICAR
"DAVOU B, 2007, COMUNICAR, P75",GRUPO COMUNICAR
"CHUNG SK, 2007, INT J ART DES EDUC, V26, P98, DOI 10.1111/J.1476-8070.2007.00514.X",BLACKWELL PUBLISHING
"[ANONYMOUS], 2007, ENGL AUST, V42, P85",AATE-AUSTRALIAN ASSOC TEACHING ENGLISH
"BANERJEE SC, 2007, HEALTH COMMUN, V22, P37, DOI 10.1080/10410230701310281",LAWRENCE ERLBAUM ASSOC INC-TAYLOR & FRANCIS
"PINKLETON BE, 2007, HEALTH COMMUN, V21, P23, DOI 10.1080/10410230701283306",LAWRENCE ERLBAUM ASSOC INC-TAYLOR & FRANCIS
"WINSKEL H, 2006, BRIT J EDUC PSYCHOL, V76, P727, DOI 10.1348/000709905X68312",BRITISH PSYCHOLOGICAL SOC
"YUS F, 2006, LANGUAGE, V82, P953, DOI 10.1353/LAN.2006.0242",LINGUISTIC SOC AMER
"SELWYN N, 2006, BRIT J EDUC TECHNOL, V37, P985, DOI 10.1111/J.1467-8535.2006.00660_14.X",BLACKWELL PUBLISHING
"ISLAM RL, 2006, COLL RES LIBR, V67, P492",ASSOC COLL RESEARCH LIBRARIES
"BROWN JD, 2006, J ADOLESCENT HEALTH, V39, P459, DOI 10.1016/J.JADOHEALTH.2006.07.014",ELSEVIER SCIENCE INC
"PRIMACK BA, 2006, J ADOLESCENT HEALTH, V39, P465, DOI 10.1016/J.JADOHEALTH.2006.05.011",ELSEVIER SCIENCE INC
"NEWKIRK T, 2006, EDUC LEADERSHIP, V64, P62",ASSOC SUPERVISION CURRICULUM DEVELOPMENT
"TRIER J, 2006, J ADOLESC ADULT LIT, V50, P68, DOI 10.1598/JAAL.50.1.7",INT READING ASSOC
"BROSSARD D, 2006, SCI COMMUN, V28, P47, DOI 10.1177/1075547006291345",SAGE PUBLICATIONS INC
"WILKSCH SM, 2006, INT J EAT DISORDER, V39, P385, DOI 10.1002/EAR.20237",JOHN WILEY & SONS INC
"BRESCIA W, 2006, BRIT J EDUC TECHNOL, V37, P496, DOI 10.1111/J.1467-8535.2006.00607_6.X",BLACKWELL PUBLISHING
"VARGAS L, 2006, HISPANIC J BEHAV SCI, V28, P267, DOI 10.1177/0739986305285823",SAGE PUBLICATIONS INC
"WEASENFORTH D, 2006, LANG LEARN TECHNOL, V10, P25",UNIV HAWAII
"WEASENFORTH D, 2006, LANG LEARN TECHNOL, V10, P25", NATL FOREIGN LANGUAGE RESOURCE CENTER
"GRUBA P, 2006, LANG LEARN TECHNOL, V10, P77",UNIV HAWAII
"GRUBA P, 2006, LANG LEARN TECHNOL, V10, P77", NATL FOREIGN LANGUAGE RESOURCE CENTER
"ADAIR SM, 2006, PEDIATR DENT, V28, P223",AMER ACAD PEDIATRIC DENTISTRY
"BRUCE D, 2006, TEACH COLL REC, V108, P939",BLACKWELL PUBLISHING
"PRIMACK BA, 2006, ARCH PEDIAT ADOL MED, V160, P369, DOI 10.1001/ARCHPEDI.160.4.369",AMER MEDICAL ASSOC
"AONO Y, 2006, GENES GENET SYST, V81, P153",GENETICS SOC JAPAN
"TRIER J, 2006, J ADOLESC ADULT LIT-a, V49, P622, DOI 10.1598/JAAL.48.7.7",INT READING ASSOC
"AUSTIN EW, 2006, PEDIATRICS, V117, PE423, DOI 10.1542/PEDS.2005-0953",AMER ACAD PEDIATRICS
"PRIMACK BA, 2006, J ADOLESCENT HEALTH-a, V38, P93, DOI 10.1016/J.JADOHEALTH.2005.11.009",ELSEVIER SCIENCE INC
"SEW JW, 2006, DISCOURSE SOC, V17, P137, DOI 10.1177/0957926506058108",SAGE PUBLICATIONS LTD
"ZHANG L, 2006, ELECTRON LIBR, V24, P294, DOI 10.1108/02640470610671169",EMERALD GROUP PUBLISHING LIMITED
"EVANS AE, 2006, FAM COMMUNITY HEALTH, V29, P43, DOI 10.1097/00003727-200601000-00006",LIPPINCOTT WILLIAMS & WILKINS
"AUSTIN EW, 2006, INT J ADVERT, V25, P541",WORLD ADVERTISING RESEARCH CENTER
"LILLIS T, 2006, WRIT COMMUN, V23, P3, DOI 10.1177/0741088305283754",SAGE PUBLICATIONS INC
"BEAN TW, 2005, J ADOLESC ADULT LIT, V49, P361, DOI 10.1598/JAAL.49.4.8",INT READING ASSOC
"HOBBS R, 2005, J COMMUN, V55, P865",OXFORD UNIV PRESS INC
"VILA HJ, 2005, TEACH COLL REC, V107, P2537, DOI 10.1111/J.1467-9620.2005.00626.X",BLACKWELL PUBLISHING
"GRAY J, 2005, CRIT STUD MEDIA COMM, V22, P223, DOI 10.1080/07393180500201652",ROUTLEDGE JOURNALS
"GRAY J, 2005, CRIT STUD MEDIA COMM, V22, P223, DOI 10.1080/07393180500201652", TAYLOR & FRANCIS LTD
"VILLANI VS, 2005, CHILD ADOL PSYCH CL, V14, P523, DOI 10.1016/J.CHC.2005.03.001",W B SAUNDERS CO
"FOSTER AE, 2005, J LIBR INF SCI, V37, P108, DOI 10.1177/096100060503700212",SAGE PUBLICATIONS LTD
"KEENAN KL, 2005, JOURNALISM MASS COMM, V82, P462",ASSN EDUC JOURNALISM MASS COMMUNICATION
"NORTON-MEIER LA, 2005, J ADOLESC ADULT LIT, V48, P608, DOI 10.1598/JAAL.48.7.6",INT READING ASSOC
"WADSWORTH LA, 2005, CAN J DIET PRACT RES, V66, P30, DOI 10.3148/66.1.2005.30",DIETITIANS CANADA
"WATKINS J, 2005, LECT NOTES COMPUT SC, V3815, P390",SPRINGER-VERLAG BERLIN
"AUSTIN EW, 2005, HEALTH COMMUN, V18, P75, DOI 10.1207/S15327027HC1801_4",LAWRENCE ERLBAUM ASSOC INC
"BROZO WG, 2004, J LIT RES, V36, P533, DOI 10.1207/S15548430JLR3604_5",NATL READING CONFERENCE INC
"GALICIAN ML, 2004, AM BEHAV SCI, V48, P143, DOI 10.1177/0002764204268867",SAGE PUBLICATIONS INC
"BERGSMA LJ, 2004, AM BEHAV SCI, V48, P152, DOI 10.1177/0002764204267259",SAGE PUBLICATIONS INC
"RICH M, 2004, AM BEHAV SCI, V48, P165, DOI 10.1177/0002764204267261",SAGE PUBLICATIONS INC
"GONZALES R, 2004, AM BEHAV SCI, V48, P189, DOI 10.1177/0002764204267263",SAGE PUBLICATIONS INC
"DENNIS EE, 2004, AM BEHAV SCI, V48, P202, DOI 10.1177/0002764204267264",SAGE PUBLICATIONS INC
"BERG LRV, 2004, AM BEHAV SCI, V48, P219, DOI 10.1177/0002764204267266",SAGE PUBLICATIONS INC
"NATHARIUS D, 2004, AM BEHAV SCI, V48, P238, DOI 10.1177/0002764204267269",SAGE PUBLICATIONS INC
"OLSON SR, 2004, AM BEHAV SCI, V48, P248, DOI 10.1177/0002764204267272",SAGE PUBLICATIONS INC
"POTTER WJ, 2004, AM BEHAV SCI, V48, P266, DOI 10.1177/0002764204267274",SAGE PUBLICATIONS INC
"GALICIAN ML, 2004, AM BEHAV SCI-a, V48, P7, DOI 10.1177//0002764204268774",SAGE PUBLICATIONS INC
"THOMAN E, 2004, AM BEHAV SCI, V48, P18, DOI 10.1177/0002764204267246",SAGE PUBLICATIONS INC
"ROGOW F, 2004, AM BEHAV SCI, V48, P30, DOI 10.1177/0002764204267248",SAGE PUBLICATIONS INC
"HOBBS R, 2004, AM BEHAV SCI, V48, P42, DOI 10.1177/0002764204267250",SAGE PUBLICATIONS INC
"SCHEIBE CL, 2004, AM BEHAV SCI, V48, P60, DOI 10.1177/0002764204267251",SAGE PUBLICATIONS INC
"KUBEY R, 2004, AM BEHAV SCI, V48, P69, DOI 10.1177/0002764204267252",SAGE PUBLICATIONS INC
"ALVERMANN DE, 2004, AM BEHAV SCI, V48, P78, DOI 10.1177/0002764204267271",SAGE PUBLICATIONS INC
"HUNDLEY HL, 2004, AM BEHAV SCI, V48, P84, DOI 10.1177/0002764204267253",SAGE PUBLICATIONS INC
"CHRIST WG, 2004, AM BEHAV SCI, V48, P92, DOI 10.1177/0002764204267254",SAGE PUBLICATIONS INC
"CONSIDINE DM, 2004, AM BEHAV SCI, V48, P97, DOI 10.1177/0002764204267255",SAGE PUBLICATIONS INC
"MERSKIN D, 2004, AM BEHAV SCI, V48, P119, DOI 10.1177/0002764204267257",SAGE PUBLICATIONS INC
"HARRIS A, 2004, BRIT J EDUC STUD, V52, P206",BLACKWELL PUBL LTD
"SWIENCICKI J, 2004, COLL COMPOS COMMUN, V55, P762, DOI 10.2307/4140670",NATL COUNCIL TEACHERS ENGLISH
"LABERGE Y, 2004, EUR J COMMUN, V19, P249, DOI 10.1177/0267323104042920",SAGE PUBLICATIONS LTD
"MARSH J, 2004, J RES READ, V27, P181, DOI 10.1111/J.1467-9817.2004.225_4.X",BLACKWELL PUBL LTD
"BARON NS, 2004, J SOCIOLING, V8, P272",BLACKWELL PUBL LTD
"SILVERSTONE R, 2003, MEDIA CULT SOC, V26, P440, DOI 10.1177/0163443704042557",SAGE PUBLICATIONS LTD
"BEATY LM, 2004, ANTHROPOL EDUC QUART, V35",AMER ANTHROPOLOGICAL ASSOC
"KUBEY R, 2004, TELEV QUART, V34, P21",NATL ACAD TELEVISION ARTS SCIENCES
"HINDIN TJ, 2004, J AM DIET ASSOC, V104, P192, DOI 10.1016/J.JADA.2003.11.006",AMER DIETETIC ASSOC
"BEATY LM, 2003, ANTHROPOL EDUC QUART, V34",AMER ANTHROPOLOGICAL ASSOC
"MOTOMURA K, 2003, J AESTHET EDUC, V37, P58",UNIV ILLINOIS PRESS
"FRANCIS C, 2003, MED J AUSTRALIA, V179, P638",AUSTRALASIAN MED PUBL CO LTD
"GOODSON FT, 2003, J ADOLESC ADULT LIT, V47, P258",INT READING ASSOC
"HULL GA, 2003, RES TEACH ENGL, V38, P229",NATL COUNCIL TEACHERS ENGLISH
"HESSE P, 2003, YOUNG CHILDREN, V58, P20",NATL ASSOC EDUC YOUNG CHILDREN
"HILL SC, 2003, J SCHOOL HEALTH, V73, P239, DOI 10.1111/J.1746-1561.2003.TB06569.X",AMER SCHOOL HEALTH ASSOC
"HOBBS R, 2003, READ RES QUART, V38, P330, DOI 10.1598/RRQ.38.3.2",INT READING ASSOC
"ALVERMANN DE, 2003, READ RES QUART, V38, P386",INT READING ASSOC
"HAGOOD MC, 2003, READ RES QUART, V38, P387",INT READING ASSOC
"NIXON H, 2003, READ RES QUART, V38, P407",INT READING ASSOC
"PAYNE JG, 2003, J HEALTH COMMUN, V8, P124, DOI 10.1080/10810730390224983",TAYLOR & FRANCIS INC
"WADE TD, 2003, INT J EAT DISORDER, V33, P371, DOI 10.1002/EAT.10136",JOHN WILEY & SONS INC
"SCHARRER E, 2002, J ADOLESC ADULT LIT, V46, P354",INT READING ASSOC
"LELLIOTT A, 2002, COMPUT EDUC, V39, P313, DOI 10.1016/S0360-1315(02)00037-4",PERGAMON-ELSEVIER SCIENCE LTD
"MARTIN MA, 2002, J ADOLESC ADULT LIT, V46, P277",INT READING ASSOC
"RAMANATHAN V, 2002, CAN MOD LANG REV, V59, P125, DOI 10.3138/CMLR.59.1.125",CANADIAN MODERN LANGUAGE REV
"VAN HORN R, 2002, PHI DELTA KAPPAN, V84, P10, DOI 10.1177/003172170208400104",PHI DELTA KAPPA
"COHEN HL, 2002, EDUC GERONTOL, V28, P599, DOI 10.1080/03601270290099796",BRUNNER/MAZEL INC
